{
  "$schema": "https://json-schema.org/draft/2020-12/schema",
  "$id": "urn:rcp:schema:identity-claim:0.1",
  "title": "RCP IdentityClaim",
  "type": "object",
  "additionalProperties": false,
  "required": [
    "type",
    "rcp_version",
    "claim_id",
    "provider",
    "identity_type",
    "identifier",
    "verification_state",
    "issued_at"
  ],
  "properties": {
    "type": {"const": "rcp.identity_claim"},
    "rcp_version": {"const": "0.1"},
    "claim_id": {"type": "string", "minLength": 1},
    "provider": {"type": "string", "minLength": 1},
    "identity_type": {"type": "string", "minLength": 1},
    "identifier": {"type": "string", "minLength": 1},
    "verification_state": {
      "enum": [
        "verified",
        "provider_confirmed",
        "user_confirmed",
        "probable",
        "possible",
        "conflicted",
        "rejected"
      ]
    },
    "subject_hint": {"type": "string", "minLength": 1},
    "evidence_refs": {
      "type": "array",
      "items": {"type": "string", "minLength": 1},
      "uniqueItems": true
    },
    "issued_at": {"type": "string", "format": "date-time"},
    "expires_at": {"type": "string", "format": "date-time"}
  }
}
